{
  "schema_version": 2,
  "data_kind": "fixture",
  "status": "available",
  "source": {
    "publisher": "Open Science Labs",
    "system": "Google Analytics 4",
    "api": "Google Analytics Data API v1beta"
  },
  "site": "https://opensciencelabs.org",
  "hostnames": ["opensciencelabs.org"],
  "timezone": "America/New_York",
  "generated_at": "2026-09-16T06:23:00Z",
  "reporting_period": {
    "start": "2026-08-17",
    "end": "2026-09-15"
  },
  "history_period": {
    "start": "2025-09-01",
    "end": "2026-08-31"
  },
  "summary": {
    "pageviews": 1234,
    "active_users": 345,
    "sessions": 678
  },
  "monthly_history": [
    {
      "month": "2025-09",
      "start": "2025-09-01",
      "end": "2025-09-30",
      "pageviews": 210
    },
    {
      "month": "2025-10",
      "start": "2025-10-01",
      "end": "2025-10-31",
      "pageviews": 280
    },
    {
      "month": "2025-11",
      "start": "2025-11-01",
      "end": "2025-11-30",
      "pageviews": 0
    },
    {
      "month": "2025-12",
      "start": "2025-12-01",
      "end": "2025-12-31",
      "pageviews": 345
    },
    {
      "month": "2026-01",
      "start": "2026-01-01",
      "end": "2026-01-31",
      "pageviews": 410
    },
    {
      "month": "2026-02",
      "start": "2026-02-01",
      "end": "2026-02-28",
      "pageviews": 490
    },
    {
      "month": "2026-03",
      "start": "2026-03-01",
      "end": "2026-03-31",
      "pageviews": 450
    },
    {
      "month": "2026-04",
      "start": "2026-04-01",
      "end": "2026-04-30",
      "pageviews": 520
    },
    {
      "month": "2026-05",
      "start": "2026-05-01",
      "end": "2026-05-31",
      "pageviews": 640
    },
    {
      "month": "2026-06",
      "start": "2026-06-01",
      "end": "2026-06-30",
      "pageviews": 810
    },
    {
      "month": "2026-07",
      "start": "2026-07-01",
      "end": "2026-07-31",
      "pageviews": 920
    },
    {
      "month": "2026-08",
      "start": "2026-08-01",
      "end": "2026-08-31",
      "pageviews": 1100
    }
  ],
  "comparison": {
    "reporting_period": {
      "start": "2026-07-18",
      "end": "2026-08-16"
    },
    "summary": {
      "pageviews": 980,
      "active_users": 300,
      "sessions": 590
    }
  },
  "daily_history": [
    {
      "date": "2026-08-17",
      "pageviews": 30
    },
    {
      "date": "2026-08-18",
      "pageviews": 36
    },
    {
      "date": "2026-08-19",
      "pageviews": 41
    },
    {
      "date": "2026-08-20",
      "pageviews": 26
    },
    {
      "date": "2026-08-21",
      "pageviews": 38
    },
    {
      "date": "2026-08-22",
      "pageviews": 28
    },
    {
      "date": "2026-08-23",
      "pageviews": 33
    },
    {
      "date": "2026-08-24",
      "pageviews": 43
    },
    {
      "date": "2026-08-25",
      "pageviews": 45
    },
    {
      "date": "2026-08-26",
      "pageviews": 36
    },
    {
      "date": "2026-08-27",
      "pageviews": 24
    },
    {
      "date": "2026-08-28",
      "pageviews": 27
    },
    {
      "date": "2026-08-29",
      "pageviews": 31
    },
    {
      "date": "2026-08-30",
      "pageviews": 29
    },
    {
      "date": "2026-08-31",
      "pageviews": 41
    },
    {
      "date": "2026-09-01",
      "pageviews": 51
    },
    {
      "date": "2026-09-02",
      "pageviews": 42
    },
    {
      "date": "2026-09-03",
      "pageviews": 39
    },
    {
      "date": "2026-09-04",
      "pageviews": 55
    },
    {
      "date": "2026-09-05",
      "pageviews": 45
    },
    {
      "date": "2026-09-06",
      "pageviews": 48
    },
    {
      "date": "2026-09-07",
      "pageviews": 37
    },
    {
      "date": "2026-09-08",
      "pageviews": 52
    },
    {
      "date": "2026-09-09",
      "pageviews": 54
    },
    {
      "date": "2026-09-10",
      "pageviews": 32
    },
    {
      "date": "2026-09-11",
      "pageviews": 41
    },
    {
      "date": "2026-09-12",
      "pageviews": 58
    },
    {
      "date": "2026-09-13",
      "pageviews": 51
    },
    {
      "date": "2026-09-14",
      "pageviews": 46
    },
    {
      "date": "2026-09-15",
      "pageviews": 75
    }
  ],
  "breakdowns": {
    "countries": {
      "status": "available",
      "metric": "pageviews",
      "minimum_active_users": 10,
      "total": 1234,
      "other": 174,
      "rows": [
        {
          "label": "Brazil",
          "value": 410
        },
        {
          "label": "United States",
          "value": 280
        },
        {
          "label": "India",
          "value": 175
        },
        {
          "label": "Germany",
          "value": 110
        },
        {
          "label": "United Kingdom",
          "value": 85
        }
      ]
    },
    "devices": {
      "status": "available",
      "metric": "pageviews",
      "minimum_active_users": 10,
      "total": 1234,
      "other": 14,
      "rows": [
        {
          "label": "desktop",
          "value": 740
        },
        {
          "label": "mobile",
          "value": 420
        },
        {
          "label": "tablet",
          "value": 60
        }
      ]
    },
    "channels": {
      "status": "available",
      "metric": "sessions",
      "minimum_active_users": 10,
      "total": 678,
      "other": 28,
      "rows": [
        {
          "label": "Organic Search",
          "value": 310
        },
        {
          "label": "Direct",
          "value": 180
        },
        {
          "label": "Referral",
          "value": 95
        },
        {
          "label": "Organic Social",
          "value": 65
        }
      ]
    }
  }
}
